{
  "version": "1.0.0",
  "last_updated": "2026-08-29",
  "scope": {
    "regions": [
      "Hong Kong",
      "Singapore"
    ],
    "priority_universities": [
      "HKU",
      "HKUST",
      "CUHK",
      "NUS",
      "NTU"
    ],
    "degree_levels": [
      "undergraduate"
    ],
    "full_text_policy": "No third-party full essay is mirrored without an explicit compatible license or author permission."
  },
  "records": [
    {
      "id": "hku-architecture-full-tuition-2025",
      "record_type": "admitted_case",
      "universities": [
        "HKU"
      ],
      "primary_university": "HKU",
      "region": "Hong Kong",
      "degree_level": "undergraduate",
      "application_route": "international",
      "program": "Architecture",
      "intake_year": 2025,
      "outcome": "admitted_with_scholarship",
      "scholarship": "Full-tuition scholarship",
      "evidence_tier": "B+",
      "quality_score": 94,
      "featured": true,
      "essay_format": [
        "personal_statement",
        "portfolio_alignment"
      ],
      "source": {
        "title": "From the Caspian dream to Victorian Harbour realities: My Journey to HKU in Hong Kong",
        "url": "https://borderless.so/stories/from-the-caspian-dream-to-victorian-harbour-realities-my-journey-to-hku-in-hong-kong",
        "platform": "Borderless",
        "source_type": "first_person_interview",
        "published_at": null
      },
      "copyright": {
        "full_text_in_repo": false,
        "policy": "link_and_original_analysis_only",
        "license": "source retains copyright"
      },
      "summary_zh": "建筑申请者以“家”这一具体空间感受切入，再把个人观察连接到建筑学动机，并让文书主题与作品集最后一页形成呼应；公开结果为 HKU 建筑学录取及全额学费奖学金。",
      "strengths": [
        "用一个可感知的核心意象建立记忆点，而不是泛泛谈城市或排名",
        "从个人体验迅速转入学术兴趣，保持港校偏学术的语气",
        "文书与作品集互相验证，形成跨材料的一致叙事"
      ],
      "limitations": [
        "来源没有公开完整文书",
        "录取结果不能证明文书单独决定结果"
      ],
      "tags": [
        "architecture",
        "academic_motivation",
        "portfolio",
        "full_tuition",
        "international"
      ]
    },
    {
      "id": "hku-physics-math-full-tuition",
      "record_type": "admitted_case",
      "universities": [
        "HKU"
      ],
      "primary_university": "HKU",
      "region": "Hong Kong",
      "degree_level": "undergraduate",
      "application_route": "international",
      "program": "Physics / Mathematics-related study",
      "intake_year": null,
      "outcome": "admitted_with_scholarship",
      "scholarship": "Full-tuition scholarship",
      "evidence_tier": "B+",
      "quality_score": 88,
      "featured": true,
      "essay_format": [
        "personal_statement"
      ],
      "source": {
        "title": "My Journey from Pakistan to Hong Kong: A New Beginning",
        "url": "https://borderless.so/stories/my-journey-from-pakistan-to-hong-kong-a-new-beginning",
        "platform": "Borderless",
        "source_type": "first_person_interview",
        "published_at": null
      },
      "copyright": {
        "full_text_in_repo": false,
        "policy": "link_and_original_analysis_only",
        "license": "source retains copyright"
      },
      "summary_zh": "申请叙事围绕物理与数学兴趣、实际探索过程和从学术及非学术活动中获得的认识展开，同时加入社区建设经历，用于补足申请者的公共性与完整度；公开结果为 HKU 录取及全额学费奖学金。",
      "strengths": [
        "主线明确，学术兴趣不是一句自我评价，而由探索过程支撑",
        "将非学术经历写成能力和价值观证据，而不是活动清单",
        "兼顾专业准备与社区贡献"
      ],
      "limitations": [
        "来源只概述主题，没有给出完整结构或逐段文本",
        "具体入学年份与专业名称在可访问段落中不够明确"
      ],
      "tags": [
        "physics",
        "mathematics",
        "community",
        "full_tuition",
        "international"
      ]
    },
    {
      "id": "hkust-russia-full-tuition-baas",
      "record_type": "admitted_case",
      "universities": [
        "HKUST",
        "CUHK"
      ],
      "primary_university": "HKUST",
      "region": "Hong Kong",
      "degree_level": "undergraduate",
      "application_route": "international",
      "program": "Bioengineering-oriented application",
      "intake_year": null,
      "outcome": "admitted_with_scholarship",
      "scholarship": "HKUST full tuition plus HKD 50,000 Beyond Academic Admissions Scholarship; CUHK admission without scholarship",
      "evidence_tier": "B+",
      "quality_score": 96,
      "featured": true,
      "essay_format": [
        "motivation_letter",
        "scholarship_essay",
        "activity_descriptions"
      ],
      "source": {
        "title": "From Russia to Hong Kong: My 2-Year Journey to Finding the Perfect University",
        "url": "https://borderless.so/stories/from-russia-to-hong-kong-my-2-year-journey-to-finding-the-perfect-university",
        "platform": "Borderless",
        "source_type": "first_person_interview_with_outcome_images",
        "published_at": null
      },
      "copyright": {
        "full_text_in_repo": false,
        "policy": "link_and_original_analysis_only",
        "license": "source retains copyright"
      },
      "summary_zh": "申请者第二年彻底重写主文书，把经历、目标、大学阶段计划和长期志向串成同一条因果链；在 HKUST BAAS 奖学金材料中，则用两个健康相关项目证明其核心能力是组建高效团队并改善他人健康。",
      "strengths": [
        "通过前后两轮申请对比，清楚展示“活动堆砌”与“目标一致性”的差别",
        "奖学金文书以明确能力命题统领多个项目",
        "用可量化项目结果支撑领导力和社会影响",
        "有 HKUST 全额学费与 BAAS、CUHK 录取结果作为较强结果证据"
      ],
      "limitations": [
        "主文书全文未公开",
        "同一材料横跨 HKUST 与 CUHK，不能推断两校审阅偏好完全相同"
      ],
      "tags": [
        "bioengineering",
        "health",
        "leadership",
        "baas",
        "full_tuition",
        "reapplication"
      ]
    },
    {
      "id": "hkust-nigeria-full-ride-impact-statement",
      "record_type": "admitted_case",
      "universities": [
        "HKUST"
      ],
      "primary_university": "HKUST",
      "region": "Hong Kong",
      "degree_level": "undergraduate",
      "application_route": "international_second_chance",
      "program": "Undeclared / science-oriented",
      "intake_year": 2024,
      "outcome": "admitted_with_scholarship",
      "scholarship": "Full scholarship covering tuition, accommodation and living expenses",
      "evidence_tier": "B+",
      "quality_score": 94,
      "featured": true,
      "essay_format": [
        "personal_statement",
        "impact_statement"
      ],
      "source": {
        "title": "Second Chance: From Nigeria to Hong Kong with a full scholarship",
        "url": "https://borderless.so/stories/second-chance-from-nigeria-to-hong-kong-with-a-full-scholarship",
        "platform": "Borderless",
        "source_type": "first_person_interview",
        "published_at": null
      },
      "copyright": {
        "full_text_in_repo": false,
        "policy": "link_and_original_analysis_only",
        "license": "source retains copyright"
      },
      "summary_zh": "申请者把两份材料分工：impact statement 负责呈现学术与课外成果，personal statement 负责解释课程动机，并聚焦疫苗生产、制药和科研兴趣；公开结果为覆盖学费、住宿与生活费的奖学金。",
      "strengths": [
        "不同文书各自承担单一任务，避免重复",
        "专业兴趣具体到疫苗、制药和研究，而非笼统的“热爱科学”",
        "高强度成果与明确动机相互补强"
      ],
      "limitations": [
        "属于 Second Chance 特定申请安排，文书组件可能不同于常规申请",
        "没有公开完整文本"
      ],
      "tags": [
        "science",
        "vaccines",
        "pharmaceuticals",
        "research",
        "impact_statement",
        "full_ride"
      ]
    },
    {
      "id": "hkust-almaty-cs-econ-scholarship-ps",
      "record_type": "admitted_case",
      "universities": [
        "HKUST"
      ],
      "primary_university": "HKUST",
      "region": "Hong Kong",
      "degree_level": "undergraduate",
      "application_route": "international",
      "program": "Computer Science and Economics",
      "intake_year": null,
      "outcome": "admitted",
      "scholarship": "Separate scholarship personal statement discussed; award details not stated in the accessible excerpt",
      "evidence_tier": "B",
      "quality_score": 90,
      "featured": true,
      "essay_format": [
        "personal_statement",
        "scholarship_personal_statement"
      ],
      "source": {
        "title": "From Almaty to HKUST: Sabina’s Journey to Studying Computer Science and Economics in Hong Kong",
        "url": "https://borderless.so/stories/from-almaty-to-hkust-sabina-s-journey-to-studying-computer-science-and-economics-in-hong-kong",
        "platform": "Borderless",
        "source_type": "first_person_interview",
        "published_at": "2026-06-30"
      },
      "copyright": {
        "full_text_in_repo": false,
        "policy": "link_and_original_analysis_only",
        "license": "source retains copyright"
      },
      "summary_zh": "主文书采取直接、正式的动机信结构：我是谁、为什么选择 HKUST、为什么选择目标专业；奖学金文书再利用经济学竞赛、跨校创业项目等经历展示学业之外的个性和实践能力。",
      "strengths": [
        "结构高度适配港校专业导向申请",
        "主申请与奖学金申请分层表达",
        "跨学科专业选择由经济学与计算机实践共同支撑"
      ],
      "limitations": [
        "来源未公开完整文书",
        "奖学金最终结果在可访问段落中不够明确"
      ],
      "tags": [
        "computer_science",
        "economics",
        "startup",
        "olympiad",
        "scholarship"
      ]
    },
    {
      "id": "cuhk-full-scholarship-offer-daniya",
      "record_type": "outcome_reference",
      "universities": [
        "CUHK"
      ],
      "primary_university": "CUHK",
      "region": "Hong Kong",
      "degree_level": "undergraduate",
      "application_route": "school_nomination_international",
      "program": null,
      "intake_year": 2023,
      "outcome": "admitted_with_scholarship",
      "scholarship": "Full tuition plus an additional scholarship",
      "evidence_tier": "C+",
      "quality_score": 70,
      "featured": false,
      "essay_format": [
        "not_disclosed"
      ],
      "source": {
        "title": "My Journey to a Full Scholarship at Minerva University",
        "url": "https://borderless.so/stories/my-journey-to-a-full-scholarship-at-minerva-university",
        "platform": "Borderless",
        "source_type": "first_person_interview",
        "published_at": "2023-10-06"
      },
      "copyright": {
        "full_text_in_repo": false,
        "policy": "metadata_and_outcome_reference_only",